No.     Time           Source                Destination           Protocol Length Info
      1 0.000000       10.7.59.214           10.7.59.214           ICMP     98     Destination unreachable (Host unreachable)

Frame 1: 98 bytes on wire (784 bits), 98 bytes captured (784 bits) on interface \Device\NPF_Loopback, id 0
Null/Loopback
Internet Protocol Version 4, Src: 10.7.59.214, Dst: 10.7.59.214
Internet Control Message Protocol
Domain Name System (query)

No.     Time           Source                Destination           Protocol Length Info
      2 4.006006       10.7.59.214           10.7.59.214           ICMP     98     Destination unreachable (Host unreachable)

Frame 2: 98 bytes on wire (784 bits), 98 bytes captured (784 bits) on interface \Device\NPF_Loopback, id 0
Null/Loopback
Internet Protocol Version 4, Src: 10.7.59.214, Dst: 10.7.59.214
Internet Control Message Protocol
Domain Name System (query)

No.     Time           Source                Destination           Protocol Length Info
      3 7.995021       10.7.59.214           10.7.59.214           ICMP     73     Destination unreachable (Host unreachable)

Frame 3: 73 bytes on wire (584 bits), 73 bytes captured (584 bits) on interface \Device\NPF_Loopback, id 0
Null/Loopback
Internet Protocol Version 4, Src: 10.7.59.214, Dst: 10.7.59.214
Internet Control Message Protocol

No.     Time           Source                Destination           Protocol Length Info
      4 16.693036      192.168.56.1          192.168.56.1          TCP      56     57406 → 40000 [SYN] Seq=0 Win=65535 Len=0 MSS=65495 WS=256 SACK_PERM=1

Frame 4: 56 bytes on wire (448 bits), 56 bytes captured (448 bits) on interface \Device\NPF_Loopback, id 0
Null/Loopback
Internet Protocol Version 4, Src: 192.168.56.1, Dst: 192.168.56.1
Transmission Control Protocol, Src Port: 57406, Dst Port: 40000, Seq: 0, Len: 0

No.     Time           Source                Destination           Protocol Length Info
      5 16.693192      192.168.56.1          192.168.56.1          TCP      56     40000 → 57406 [SYN, ACK] Seq=0 Ack=1 Win=65535 Len=0 MSS=65495 WS=256 SACK_PERM=1

Frame 5: 56 bytes on wire (448 bits), 56 bytes captured (448 bits) on interface \Device\NPF_Loopback, id 0
Null/Loopback
Internet Protocol Version 4, Src: 192.168.56.1, Dst: 192.168.56.1
Transmission Control Protocol, Src Port: 40000, Dst Port: 57406, Seq: 0, Ack: 1, Len: 0

No.     Time           Source                Destination           Protocol Length Info
      6 16.693273      192.168.56.1          192.168.56.1          TCP      44     57406 → 40000 [ACK] Seq=1 Ack=1 Win=2619648 Len=0

Frame 6: 44 bytes on wire (352 bits), 44 bytes captured (352 bits) on interface \Device\NPF_Loopback, id 0
Null/Loopback
Internet Protocol Version 4, Src: 192.168.56.1, Dst: 192.168.56.1
Transmission Control Protocol, Src Port: 57406, Dst Port: 40000, Seq: 1, Ack: 1, Len: 0

No.     Time           Source                Destination           Protocol Length Info
      7 26.131197      192.168.56.1          192.168.56.1          TCP      47     57406 → 40000 [PSH, ACK] Seq=1 Ack=1 Win=2619648 Len=3 [TCP segment of a reassembled PDU]

Frame 7: 47 bytes on wire (376 bits), 47 bytes captured (376 bits) on interface \Device\NPF_Loopback, id 0
Null/Loopback
Internet Protocol Version 4, Src: 192.168.56.1, Dst: 192.168.56.1
Transmission Control Protocol, Src Port: 57406, Dst Port: 40000, Seq: 1, Ack: 1, Len: 3

No.     Time           Source                Destination           Protocol Length Info
      8 26.131315      192.168.56.1          192.168.56.1          TCP      44     40000 → 57406 [ACK] Seq=1 Ack=4 Win=2619648 Len=0

Frame 8: 44 bytes on wire (352 bits), 44 bytes captured (352 bits) on interface \Device\NPF_Loopback, id 0
Null/Loopback
Internet Protocol Version 4, Src: 192.168.56.1, Dst: 192.168.56.1
Transmission Control Protocol, Src Port: 40000, Dst Port: 57406, Seq: 1, Ack: 4, Len: 0

No.     Time           Source                Destination           Protocol Length Info
      9 26.131396      192.168.56.1          192.168.56.1          TCP      45     57406 → 40000 [PSH, ACK] Seq=4 Ack=1 Win=2619648 Len=1 [TCP segment of a reassembled PDU]

Frame 9: 45 bytes on wire (360 bits), 45 bytes captured (360 bits) on interface \Device\NPF_Loopback, id 0
Null/Loopback
Internet Protocol Version 4, Src: 192.168.56.1, Dst: 192.168.56.1
Transmission Control Protocol, Src Port: 57406, Dst Port: 40000, Seq: 4, Ack: 1, Len: 1

No.     Time           Source                Destination           Protocol Length Info
     10 26.131450      192.168.56.1          192.168.56.1          TCP      44     40000 → 57406 [ACK] Seq=1 Ack=5 Win=2619648 Len=0

Frame 10: 44 bytes on wire (352 bits), 44 bytes captured (352 bits) on interface \Device\NPF_Loopback, id 0
Null/Loopback
Internet Protocol Version 4, Src: 192.168.56.1, Dst: 192.168.56.1
Transmission Control Protocol, Src Port: 40000, Dst Port: 57406, Seq: 1, Ack: 5, Len: 0

No.     Time           Source                Destination           Protocol Length Info
     11 26.132019      192.168.56.1          192.168.56.1          TCP      47     40000 → 57406 [PSH, ACK] Seq=1 Ack=5 Win=2619648 Len=3 [TCP segment of a reassembled PDU]

Frame 11: 47 bytes on wire (376 bits), 47 bytes captured (376 bits) on interface \Device\NPF_Loopback, id 0
Null/Loopback
Internet Protocol Version 4, Src: 192.168.56.1, Dst: 192.168.56.1
Transmission Control Protocol, Src Port: 40000, Dst Port: 57406, Seq: 1, Ack: 5, Len: 3

No.     Time           Source                Destination           Protocol Length Info
     12 26.132074      192.168.56.1          192.168.56.1          TCP      44     57406 → 40000 [ACK] Seq=5 Ack=4 Win=2619648 Len=0

Frame 12: 44 bytes on wire (352 bits), 44 bytes captured (352 bits) on interface \Device\NPF_Loopback, id 0
Null/Loopback
Internet Protocol Version 4, Src: 192.168.56.1, Dst: 192.168.56.1
Transmission Control Protocol, Src Port: 57406, Dst Port: 40000, Seq: 5, Ack: 4, Len: 0

No.     Time           Source                Destination           Protocol Length Info
     13 28.998752      192.168.56.1          192.168.56.1          TCP      47     57406 → 40000 [PSH, ACK] Seq=5 Ack=4 Win=2619648 Len=3 [TCP segment of a reassembled PDU]

Frame 13: 47 bytes on wire (376 bits), 47 bytes captured (376 bits) on interface \Device\NPF_Loopback, id 0
Null/Loopback
Internet Protocol Version 4, Src: 192.168.56.1, Dst: 192.168.56.1
Transmission Control Protocol, Src Port: 57406, Dst Port: 40000, Seq: 5, Ack: 4, Len: 3

No.     Time           Source                Destination           Protocol Length Info
     14 28.998867      192.168.56.1          192.168.56.1          TCP      44     40000 → 57406 [ACK] Seq=4 Ack=8 Win=2619648 Len=0

Frame 14: 44 bytes on wire (352 bits), 44 bytes captured (352 bits) on interface \Device\NPF_Loopback, id 0
Null/Loopback
Internet Protocol Version 4, Src: 192.168.56.1, Dst: 192.168.56.1
Transmission Control Protocol, Src Port: 40000, Dst Port: 57406, Seq: 4, Ack: 8, Len: 0

No.     Time           Source                Destination           Protocol Length Info
     15 28.999018      192.168.56.1          192.168.56.1          TCP      45     57406 → 40000 [PSH, ACK] Seq=8 Ack=4 Win=2619648 Len=1 [TCP segment of a reassembled PDU]

Frame 15: 45 bytes on wire (360 bits), 45 bytes captured (360 bits) on interface \Device\NPF_Loopback, id 0
Null/Loopback
Internet Protocol Version 4, Src: 192.168.56.1, Dst: 192.168.56.1
Transmission Control Protocol, Src Port: 57406, Dst Port: 40000, Seq: 8, Ack: 4, Len: 1

No.     Time           Source                Destination           Protocol Length Info
     16 28.999076      192.168.56.1          192.168.56.1          TCP      44     40000 → 57406 [ACK] Seq=4 Ack=9 Win=2619648 Len=0

Frame 16: 44 bytes on wire (352 bits), 44 bytes captured (352 bits) on interface \Device\NPF_Loopback, id 0
Null/Loopback
Internet Protocol Version 4, Src: 192.168.56.1, Dst: 192.168.56.1
Transmission Control Protocol, Src Port: 40000, Dst Port: 57406, Seq: 4, Ack: 9, Len: 0

No.     Time           Source                Destination           Protocol Length Info
     17 28.999623      192.168.56.1          192.168.56.1          TCP      47     40000 → 57406 [PSH, ACK] Seq=4 Ack=9 Win=2619648 Len=3 [TCP segment of a reassembled PDU]

Frame 17: 47 bytes on wire (376 bits), 47 bytes captured (376 bits) on interface \Device\NPF_Loopback, id 0
Null/Loopback
Internet Protocol Version 4, Src: 192.168.56.1, Dst: 192.168.56.1
Transmission Control Protocol, Src Port: 40000, Dst Port: 57406, Seq: 4, Ack: 9, Len: 3

No.     Time           Source                Destination           Protocol Length Info
     18 28.999692      192.168.56.1          192.168.56.1          TCP      44     57406 → 40000 [ACK] Seq=9 Ack=7 Win=2619648 Len=0

Frame 18: 44 bytes on wire (352 bits), 44 bytes captured (352 bits) on interface \Device\NPF_Loopback, id 0
Null/Loopback
Internet Protocol Version 4, Src: 192.168.56.1, Dst: 192.168.56.1
Transmission Control Protocol, Src Port: 57406, Dst Port: 40000, Seq: 9, Ack: 7, Len: 0

No.     Time           Source                Destination           Protocol Length Info
     19 31.433363      192.168.56.1          192.168.56.1          TCP      47     57406 → 40000 [PSH, ACK] Seq=9 Ack=7 Win=2619648 Len=3 [TCP segment of a reassembled PDU]

Frame 19: 47 bytes on wire (376 bits), 47 bytes captured (376 bits) on interface \Device\NPF_Loopback, id 0
Null/Loopback
Internet Protocol Version 4, Src: 192.168.56.1, Dst: 192.168.56.1
Transmission Control Protocol, Src Port: 57406, Dst Port: 40000, Seq: 9, Ack: 7, Len: 3

No.     Time           Source                Destination           Protocol Length Info
     20 31.433463      192.168.56.1          192.168.56.1          TCP      44     40000 → 57406 [ACK] Seq=7 Ack=12 Win=2619648 Len=0

Frame 20: 44 bytes on wire (352 bits), 44 bytes captured (352 bits) on interface \Device\NPF_Loopback, id 0
Null/Loopback
Internet Protocol Version 4, Src: 192.168.56.1, Dst: 192.168.56.1
Transmission Control Protocol, Src Port: 40000, Dst Port: 57406, Seq: 7, Ack: 12, Len: 0

No.     Time           Source                Destination           Protocol Length Info
     21 31.433598      192.168.56.1          192.168.56.1          TCP      45     57406 → 40000 [PSH, ACK] Seq=12 Ack=7 Win=2619648 Len=1 [TCP segment of a reassembled PDU]

Frame 21: 45 bytes on wire (360 bits), 45 bytes captured (360 bits) on interface \Device\NPF_Loopback, id 0
Null/Loopback
Internet Protocol Version 4, Src: 192.168.56.1, Dst: 192.168.56.1
Transmission Control Protocol, Src Port: 57406, Dst Port: 40000, Seq: 12, Ack: 7, Len: 1

No.     Time           Source                Destination           Protocol Length Info
     22 31.433683      192.168.56.1          192.168.56.1          TCP      44     40000 → 57406 [ACK] Seq=7 Ack=13 Win=2619648 Len=0

Frame 22: 44 bytes on wire (352 bits), 44 bytes captured (352 bits) on interface \Device\NPF_Loopback, id 0
Null/Loopback
Internet Protocol Version 4, Src: 192.168.56.1, Dst: 192.168.56.1
Transmission Control Protocol, Src Port: 40000, Dst Port: 57406, Seq: 7, Ack: 13, Len: 0

No.     Time           Source                Destination           Protocol Length Info
     23 31.434305      192.168.56.1          192.168.56.1          TCP      47     40000 → 57406 [PSH, ACK] Seq=7 Ack=13 Win=2619648 Len=3 [TCP segment of a reassembled PDU]

Frame 23: 47 bytes on wire (376 bits), 47 bytes captured (376 bits) on interface \Device\NPF_Loopback, id 0
Null/Loopback
Internet Protocol Version 4, Src: 192.168.56.1, Dst: 192.168.56.1
Transmission Control Protocol, Src Port: 40000, Dst Port: 57406, Seq: 7, Ack: 13, Len: 3

No.     Time           Source                Destination           Protocol Length Info
     24 31.434371      192.168.56.1          192.168.56.1          TCP      44     57406 → 40000 [ACK] Seq=13 Ack=10 Win=2619648 Len=0

Frame 24: 44 bytes on wire (352 bits), 44 bytes captured (352 bits) on interface \Device\NPF_Loopback, id 0
Null/Loopback
Internet Protocol Version 4, Src: 192.168.56.1, Dst: 192.168.56.1
Transmission Control Protocol, Src Port: 57406, Dst Port: 40000, Seq: 13, Ack: 10, Len: 0

No.     Time           Source                Destination           Protocol Length Info
     25 34.891105      192.168.56.1          239.255.255.250       SSDP     207    M-SEARCH * HTTP/1.1 

Frame 25: 207 bytes on wire (1656 bits), 207 bytes captured (1656 bits) on interface \Device\NPF_Loopback, id 0
Null/Loopback
Internet Protocol Version 4, Src: 192.168.56.1, Dst: 239.255.255.250
User Datagram Protocol, Src Port: 58908, Dst Port: 1900
Simple Service Discovery Protocol

No.     Time           Source                Destination           Protocol Length Info
     26 34.938347      192.168.56.1          239.255.255.250       SSDP     201    M-SEARCH * HTTP/1.1 

Frame 26: 201 bytes on wire (1608 bits), 201 bytes captured (1608 bits) on interface \Device\NPF_Loopback, id 0
Null/Loopback
Internet Protocol Version 4, Src: 192.168.56.1, Dst: 239.255.255.250
User Datagram Protocol, Src Port: 58909, Dst Port: 1900
Simple Service Discovery Protocol

No.     Time           Source                Destination           Protocol Length Info
     27 35.464809      192.168.56.1          192.168.56.1          TCP      46     57406 → 40000 [PSH, ACK] Seq=13 Ack=10 Win=2619648 Len=2 [TCP segment of a reassembled PDU]

Frame 27: 46 bytes on wire (368 bits), 46 bytes captured (368 bits) on interface \Device\NPF_Loopback, id 0
Null/Loopback
Internet Protocol Version 4, Src: 192.168.56.1, Dst: 192.168.56.1
Transmission Control Protocol, Src Port: 57406, Dst Port: 40000, Seq: 13, Ack: 10, Len: 2

No.     Time           Source                Destination           Protocol Length Info
     28 35.464899      192.168.56.1          192.168.56.1          TCP      44     40000 → 57406 [ACK] Seq=10 Ack=15 Win=2619648 Len=0

Frame 28: 44 bytes on wire (352 bits), 44 bytes captured (352 bits) on interface \Device\NPF_Loopback, id 0
Null/Loopback
Internet Protocol Version 4, Src: 192.168.56.1, Dst: 192.168.56.1
Transmission Control Protocol, Src Port: 40000, Dst Port: 57406, Seq: 10, Ack: 15, Len: 0

No.     Time           Source                Destination           Protocol Length Info
     29 35.464972      192.168.56.1          192.168.56.1          TCP      45     57406 → 40000 [PSH, ACK] Seq=15 Ack=10 Win=2619648 Len=1 [TCP segment of a reassembled PDU]

Frame 29: 45 bytes on wire (360 bits), 45 bytes captured (360 bits) on interface \Device\NPF_Loopback, id 0
Null/Loopback
Internet Protocol Version 4, Src: 192.168.56.1, Dst: 192.168.56.1
Transmission Control Protocol, Src Port: 57406, Dst Port: 40000, Seq: 15, Ack: 10, Len: 1

No.     Time           Source                Destination           Protocol Length Info
     30 35.465018      192.168.56.1          192.168.56.1          TCP      44     40000 → 57406 [ACK] Seq=10 Ack=16 Win=2619648 Len=0

Frame 30: 44 bytes on wire (352 bits), 44 bytes captured (352 bits) on interface \Device\NPF_Loopback, id 0
Null/Loopback
Internet Protocol Version 4, Src: 192.168.56.1, Dst: 192.168.56.1
Transmission Control Protocol, Src Port: 40000, Dst Port: 57406, Seq: 10, Ack: 16, Len: 0

No.     Time           Source                Destination           Protocol Length Info
     31 35.466356      192.168.56.1          192.168.56.1          TCP      141    40000 → 57406 [PSH, ACK] Seq=10 Ack=16 Win=2619648 Len=97 [TCP segment of a reassembled PDU]

Frame 31: 141 bytes on wire (1128 bits), 141 bytes captured (1128 bits) on interface \Device\NPF_Loopback, id 0
Null/Loopback
Internet Protocol Version 4, Src: 192.168.56.1, Dst: 192.168.56.1
Transmission Control Protocol, Src Port: 40000, Dst Port: 57406, Seq: 10, Ack: 16, Len: 97

No.     Time           Source                Destination           Protocol Length Info
     32 35.466432      192.168.56.1          192.168.56.1          TCP      44     57406 → 40000 [ACK] Seq=16 Ack=107 Win=2619648 Len=0

Frame 32: 44 bytes on wire (352 bits), 44 bytes captured (352 bits) on interface \Device\NPF_Loopback, id 0
Null/Loopback
Internet Protocol Version 4, Src: 192.168.56.1, Dst: 192.168.56.1
Transmission Control Protocol, Src Port: 57406, Dst Port: 40000, Seq: 16, Ack: 107, Len: 0

No.     Time           Source                Destination           Protocol Length Info
     33 35.894651      192.168.56.1          239.255.255.250       SSDP     207    M-SEARCH * HTTP/1.1 

Frame 33: 207 bytes on wire (1656 bits), 207 bytes captured (1656 bits) on interface \Device\NPF_Loopback, id 0
Null/Loopback
Internet Protocol Version 4, Src: 192.168.56.1, Dst: 239.255.255.250
User Datagram Protocol, Src Port: 58908, Dst Port: 1900
Simple Service Discovery Protocol

No.     Time           Source                Destination           Protocol Length Info
     34 35.942217      192.168.56.1          239.255.255.250       SSDP     201    M-SEARCH * HTTP/1.1 

Frame 34: 201 bytes on wire (1608 bits), 201 bytes captured (1608 bits) on interface \Device\NPF_Loopback, id 0
Null/Loopback
Internet Protocol Version 4, Src: 192.168.56.1, Dst: 239.255.255.250
User Datagram Protocol, Src Port: 58909, Dst Port: 1900
Simple Service Discovery Protocol

No.     Time           Source                Destination           Protocol Length Info
     35 36.904455      192.168.56.1          239.255.255.250       SSDP     207    M-SEARCH * HTTP/1.1 

Frame 35: 207 bytes on wire (1656 bits), 207 bytes captured (1656 bits) on interface \Device\NPF_Loopback, id 0
Null/Loopback
Internet Protocol Version 4, Src: 192.168.56.1, Dst: 239.255.255.250
User Datagram Protocol, Src Port: 58908, Dst Port: 1900
Simple Service Discovery Protocol

No.     Time           Source                Destination           Protocol Length Info
     36 36.951326      192.168.56.1          239.255.255.250       SSDP     201    M-SEARCH * HTTP/1.1 

Frame 36: 201 bytes on wire (1608 bits), 201 bytes captured (1608 bits) on interface \Device\NPF_Loopback, id 0
Null/Loopback
Internet Protocol Version 4, Src: 192.168.56.1, Dst: 239.255.255.250
User Datagram Protocol, Src Port: 58909, Dst Port: 1900
Simple Service Discovery Protocol

No.     Time           Source                Destination           Protocol Length Info
     37 37.570437      192.168.56.1          192.168.56.1          TCP      46     57406 → 40000 [PSH, ACK] Seq=16 Ack=107 Win=2619648 Len=2 [TCP segment of a reassembled PDU]

Frame 37: 46 bytes on wire (368 bits), 46 bytes captured (368 bits) on interface \Device\NPF_Loopback, id 0
Null/Loopback
Internet Protocol Version 4, Src: 192.168.56.1, Dst: 192.168.56.1
Transmission Control Protocol, Src Port: 57406, Dst Port: 40000, Seq: 16, Ack: 107, Len: 2

No.     Time           Source                Destination           Protocol Length Info
     38 37.570526      192.168.56.1          192.168.56.1          TCP      44     40000 → 57406 [ACK] Seq=107 Ack=18 Win=2619648 Len=0

Frame 38: 44 bytes on wire (352 bits), 44 bytes captured (352 bits) on interface \Device\NPF_Loopback, id 0
Null/Loopback
Internet Protocol Version 4, Src: 192.168.56.1, Dst: 192.168.56.1
Transmission Control Protocol, Src Port: 40000, Dst Port: 57406, Seq: 107, Ack: 18, Len: 0

No.     Time           Source                Destination           Protocol Length Info
     39 37.570597      192.168.56.1          192.168.56.1          TCP      45     57406 → 40000 [PSH, ACK] Seq=18 Ack=107 Win=2619648 Len=1 [TCP segment of a reassembled PDU]

Frame 39: 45 bytes on wire (360 bits), 45 bytes captured (360 bits) on interface \Device\NPF_Loopback, id 0
Null/Loopback
Internet Protocol Version 4, Src: 192.168.56.1, Dst: 192.168.56.1
Transmission Control Protocol, Src Port: 57406, Dst Port: 40000, Seq: 18, Ack: 107, Len: 1

No.     Time           Source                Destination           Protocol Length Info
     40 37.570658      192.168.56.1          192.168.56.1          TCP      44     40000 → 57406 [ACK] Seq=107 Ack=19 Win=2619648 Len=0

Frame 40: 44 bytes on wire (352 bits), 44 bytes captured (352 bits) on interface \Device\NPF_Loopback, id 0
Null/Loopback
Internet Protocol Version 4, Src: 192.168.56.1, Dst: 192.168.56.1
Transmission Control Protocol, Src Port: 40000, Dst Port: 57406, Seq: 107, Ack: 19, Len: 0

No.     Time           Source                Destination           Protocol Length Info
     41 37.571603      192.168.56.1          192.168.56.1          TCP      141    40000 → 57406 [PSH, ACK] Seq=107 Ack=19 Win=2619648 Len=97 [TCP segment of a reassembled PDU]

Frame 41: 141 bytes on wire (1128 bits), 141 bytes captured (1128 bits) on interface \Device\NPF_Loopback, id 0
Null/Loopback
Internet Protocol Version 4, Src: 192.168.56.1, Dst: 192.168.56.1
Transmission Control Protocol, Src Port: 40000, Dst Port: 57406, Seq: 107, Ack: 19, Len: 97

No.     Time           Source                Destination           Protocol Length Info
     42 37.571701      192.168.56.1          192.168.56.1          TCP      44     57406 → 40000 [ACK] Seq=19 Ack=204 Win=2619392 Len=0

Frame 42: 44 bytes on wire (352 bits), 44 bytes captured (352 bits) on interface \Device\NPF_Loopback, id 0
Null/Loopback
Internet Protocol Version 4, Src: 192.168.56.1, Dst: 192.168.56.1
Transmission Control Protocol, Src Port: 57406, Dst Port: 40000, Seq: 19, Ack: 204, Len: 0

No.     Time           Source                Destination           Protocol Length Info
     43 37.916169      192.168.56.1          239.255.255.250       SSDP     207    M-SEARCH * HTTP/1.1 

Frame 43: 207 bytes on wire (1656 bits), 207 bytes captured (1656 bits) on interface \Device\NPF_Loopback, id 0
Null/Loopback
Internet Protocol Version 4, Src: 192.168.56.1, Dst: 239.255.255.250
User Datagram Protocol, Src Port: 58908, Dst Port: 1900
Simple Service Discovery Protocol

No.     Time           Source                Destination           Protocol Length Info
     44 37.963515      192.168.56.1          239.255.255.250       SSDP     201    M-SEARCH * HTTP/1.1 

Frame 44: 201 bytes on wire (1608 bits), 201 bytes captured (1608 bits) on interface \Device\NPF_Loopback, id 0
Null/Loopback
Internet Protocol Version 4, Src: 192.168.56.1, Dst: 239.255.255.250
User Datagram Protocol, Src Port: 58909, Dst Port: 1900
Simple Service Discovery Protocol

No.     Time           Source                Destination           Protocol Length Info
     45 42.423865      192.168.56.1          192.168.56.1          TCP      46     57406 → 40000 [PSH, ACK] Seq=19 Ack=204 Win=2619392 Len=2 [TCP segment of a reassembled PDU]

Frame 45: 46 bytes on wire (368 bits), 46 bytes captured (368 bits) on interface \Device\NPF_Loopback, id 0
Null/Loopback
Internet Protocol Version 4, Src: 192.168.56.1, Dst: 192.168.56.1
Transmission Control Protocol, Src Port: 57406, Dst Port: 40000, Seq: 19, Ack: 204, Len: 2

No.     Time           Source                Destination           Protocol Length Info
     46 42.423918      192.168.56.1          192.168.56.1          TCP      44     40000 → 57406 [ACK] Seq=204 Ack=21 Win=2619648 Len=0

Frame 46: 44 bytes on wire (352 bits), 44 bytes captured (352 bits) on interface \Device\NPF_Loopback, id 0
Null/Loopback
Internet Protocol Version 4, Src: 192.168.56.1, Dst: 192.168.56.1
Transmission Control Protocol, Src Port: 40000, Dst Port: 57406, Seq: 204, Ack: 21, Len: 0

No.     Time           Source                Destination           Protocol Length Info
     47 42.423959      192.168.56.1          192.168.56.1          TCP      45     57406 → 40000 [PSH, ACK] Seq=21 Ack=204 Win=2619392 Len=1 [TCP segment of a reassembled PDU]

Frame 47: 45 bytes on wire (360 bits), 45 bytes captured (360 bits) on interface \Device\NPF_Loopback, id 0
Null/Loopback
Internet Protocol Version 4, Src: 192.168.56.1, Dst: 192.168.56.1
Transmission Control Protocol, Src Port: 57406, Dst Port: 40000, Seq: 21, Ack: 204, Len: 1

No.     Time           Source                Destination           Protocol Length Info
     48 42.423982      192.168.56.1          192.168.56.1          TCP      44     40000 → 57406 [ACK] Seq=204 Ack=22 Win=2619648 Len=0

Frame 48: 44 bytes on wire (352 bits), 44 bytes captured (352 bits) on interface \Device\NPF_Loopback, id 0
Null/Loopback
Internet Protocol Version 4, Src: 192.168.56.1, Dst: 192.168.56.1
Transmission Control Protocol, Src Port: 40000, Dst Port: 57406, Seq: 204, Ack: 22, Len: 0

No.     Time           Source                Destination           Protocol Length Info
     49 42.424507      192.168.56.1          192.168.56.1          TCP      141    40000 → 57406 [PSH, ACK] Seq=204 Ack=22 Win=2619648 Len=97 [TCP segment of a reassembled PDU]

Frame 49: 141 bytes on wire (1128 bits), 141 bytes captured (1128 bits) on interface \Device\NPF_Loopback, id 0
Null/Loopback
Internet Protocol Version 4, Src: 192.168.56.1, Dst: 192.168.56.1
Transmission Control Protocol, Src Port: 40000, Dst Port: 57406, Seq: 204, Ack: 22, Len: 97

No.     Time           Source                Destination           Protocol Length Info
     50 42.424560      192.168.56.1          192.168.56.1          TCP      44     57406 → 40000 [ACK] Seq=22 Ack=301 Win=2619392 Len=0

Frame 50: 44 bytes on wire (352 bits), 44 bytes captured (352 bits) on interface \Device\NPF_Loopback, id 0
Null/Loopback
Internet Protocol Version 4, Src: 192.168.56.1, Dst: 192.168.56.1
Transmission Control Protocol, Src Port: 57406, Dst Port: 40000, Seq: 22, Ack: 301, Len: 0

No.     Time           Source                Destination           Protocol Length Info
     51 52.993876      10.7.59.214           10.7.59.214           ICMP     73     Destination unreachable (Host unreachable)

Frame 51: 73 bytes on wire (584 bits), 73 bytes captured (584 bits) on interface \Device\NPF_Loopback, id 0
Null/Loopback
Internet Protocol Version 4, Src: 10.7.59.214, Dst: 10.7.59.214
Internet Control Message Protocol

No.     Time           Source                Destination           Protocol Length Info
     52 56.459525      192.168.56.1          192.168.56.1          TCP      73     57406 → 40000 [PSH, ACK] Seq=22 Ack=301 Win=2619392 Len=29 [TCP segment of a reassembled PDU]

Frame 52: 73 bytes on wire (584 bits), 73 bytes captured (584 bits) on interface \Device\NPF_Loopback, id 0
Null/Loopback
Internet Protocol Version 4, Src: 192.168.56.1, Dst: 192.168.56.1
Transmission Control Protocol, Src Port: 57406, Dst Port: 40000, Seq: 22, Ack: 301, Len: 29

No.     Time           Source                Destination           Protocol Length Info
     53 56.459644      192.168.56.1          192.168.56.1          TCP      44     40000 → 57406 [ACK] Seq=301 Ack=51 Win=2619648 Len=0

Frame 53: 44 bytes on wire (352 bits), 44 bytes captured (352 bits) on interface \Device\NPF_Loopback, id 0
Null/Loopback
Internet Protocol Version 4, Src: 192.168.56.1, Dst: 192.168.56.1
Transmission Control Protocol, Src Port: 40000, Dst Port: 57406, Seq: 301, Ack: 51, Len: 0

No.     Time           Source                Destination           Protocol Length Info
     54 56.459808      192.168.56.1          192.168.56.1          TCP      45     57406 → 40000 [PSH, ACK] Seq=51 Ack=301 Win=2619392 Len=1 [TCP segment of a reassembled PDU]

Frame 54: 45 bytes on wire (360 bits), 45 bytes captured (360 bits) on interface \Device\NPF_Loopback, id 0
Null/Loopback
Internet Protocol Version 4, Src: 192.168.56.1, Dst: 192.168.56.1
Transmission Control Protocol, Src Port: 57406, Dst Port: 40000, Seq: 51, Ack: 301, Len: 1

No.     Time           Source                Destination           Protocol Length Info
     55 56.459866      192.168.56.1          192.168.56.1          TCP      44     40000 → 57406 [ACK] Seq=301 Ack=52 Win=2619648 Len=0

Frame 55: 44 bytes on wire (352 bits), 44 bytes captured (352 bits) on interface \Device\NPF_Loopback, id 0
Null/Loopback
Internet Protocol Version 4, Src: 192.168.56.1, Dst: 192.168.56.1
Transmission Control Protocol, Src Port: 40000, Dst Port: 57406, Seq: 301, Ack: 52, Len: 0

No.     Time           Source                Destination           Protocol Length Info
     56 56.460781      192.168.56.1          192.168.56.1          TCP      70     40000 → 57406 [PSH, ACK] Seq=301 Ack=52 Win=2619648 Len=26 [TCP segment of a reassembled PDU]

Frame 56: 70 bytes on wire (560 bits), 70 bytes captured (560 bits) on interface \Device\NPF_Loopback, id 0
Null/Loopback
Internet Protocol Version 4, Src: 192.168.56.1, Dst: 192.168.56.1
Transmission Control Protocol, Src Port: 40000, Dst Port: 57406, Seq: 301, Ack: 52, Len: 26

No.     Time           Source                Destination           Protocol Length Info
     57 56.460859      192.168.56.1          192.168.56.1          TCP      44     57406 → 40000 [ACK] Seq=52 Ack=327 Win=2619392 Len=0

Frame 57: 44 bytes on wire (352 bits), 44 bytes captured (352 bits) on interface \Device\NPF_Loopback, id 0
Null/Loopback
Internet Protocol Version 4, Src: 192.168.56.1, Dst: 192.168.56.1
Transmission Control Protocol, Src Port: 57406, Dst Port: 40000, Seq: 52, Ack: 327, Len: 0

No.     Time           Source                Destination           Protocol Length Info
     58 62.263008      192.168.56.1          192.168.56.1          TCP      73     57406 → 40000 [PSH, ACK] Seq=52 Ack=327 Win=2619392 Len=29 [TCP segment of a reassembled PDU]

Frame 58: 73 bytes on wire (584 bits), 73 bytes captured (584 bits) on interface \Device\NPF_Loopback, id 0
Null/Loopback
Internet Protocol Version 4, Src: 192.168.56.1, Dst: 192.168.56.1
Transmission Control Protocol, Src Port: 57406, Dst Port: 40000, Seq: 52, Ack: 327, Len: 29

No.     Time           Source                Destination           Protocol Length Info
     59 62.263118      192.168.56.1          192.168.56.1          TCP      44     40000 → 57406 [ACK] Seq=327 Ack=81 Win=2619648 Len=0

Frame 59: 44 bytes on wire (352 bits), 44 bytes captured (352 bits) on interface \Device\NPF_Loopback, id 0
Null/Loopback
Internet Protocol Version 4, Src: 192.168.56.1, Dst: 192.168.56.1
Transmission Control Protocol, Src Port: 40000, Dst Port: 57406, Seq: 327, Ack: 81, Len: 0

No.     Time           Source                Destination           Protocol Length Info
     60 62.263215      192.168.56.1          192.168.56.1          TCP      45     57406 → 40000 [PSH, ACK] Seq=81 Ack=327 Win=2619392 Len=1 [TCP segment of a reassembled PDU]

Frame 60: 45 bytes on wire (360 bits), 45 bytes captured (360 bits) on interface \Device\NPF_Loopback, id 0
Null/Loopback
Internet Protocol Version 4, Src: 192.168.56.1, Dst: 192.168.56.1
Transmission Control Protocol, Src Port: 57406, Dst Port: 40000, Seq: 81, Ack: 327, Len: 1

No.     Time           Source                Destination           Protocol Length Info
     61 62.263261      192.168.56.1          192.168.56.1          TCP      44     40000 → 57406 [ACK] Seq=327 Ack=82 Win=2619648 Len=0

Frame 61: 44 bytes on wire (352 bits), 44 bytes captured (352 bits) on interface \Device\NPF_Loopback, id 0
Null/Loopback
Internet Protocol Version 4, Src: 192.168.56.1, Dst: 192.168.56.1
Transmission Control Protocol, Src Port: 40000, Dst Port: 57406, Seq: 327, Ack: 82, Len: 0

No.     Time           Source                Destination           Protocol Length Info
     62 62.264138      192.168.56.1          192.168.56.1          TCP      70     40000 → 57406 [PSH, ACK] Seq=327 Ack=82 Win=2619648 Len=26 [TCP segment of a reassembled PDU]

Frame 62: 70 bytes on wire (560 bits), 70 bytes captured (560 bits) on interface \Device\NPF_Loopback, id 0
Null/Loopback
Internet Protocol Version 4, Src: 192.168.56.1, Dst: 192.168.56.1
Transmission Control Protocol, Src Port: 40000, Dst Port: 57406, Seq: 327, Ack: 82, Len: 26

No.     Time           Source                Destination           Protocol Length Info
     63 62.264192      192.168.56.1          192.168.56.1          TCP      44     57406 → 40000 [ACK] Seq=82 Ack=353 Win=2619392 Len=0

Frame 63: 44 bytes on wire (352 bits), 44 bytes captured (352 bits) on interface \Device\NPF_Loopback, id 0
Null/Loopback
Internet Protocol Version 4, Src: 192.168.56.1, Dst: 192.168.56.1
Transmission Control Protocol, Src Port: 57406, Dst Port: 40000, Seq: 82, Ack: 353, Len: 0

No.     Time           Source                Destination           Protocol Length Info
     64 68.246818      192.168.56.1          192.168.56.1          TCP      73     57406 → 40000 [PSH, ACK] Seq=82 Ack=353 Win=2619392 Len=29 [TCP segment of a reassembled PDU]

Frame 64: 73 bytes on wire (584 bits), 73 bytes captured (584 bits) on interface \Device\NPF_Loopback, id 0
Null/Loopback
Internet Protocol Version 4, Src: 192.168.56.1, Dst: 192.168.56.1
Transmission Control Protocol, Src Port: 57406, Dst Port: 40000, Seq: 82, Ack: 353, Len: 29

No.     Time           Source                Destination           Protocol Length Info
     65 68.246889      192.168.56.1          192.168.56.1          TCP      44     40000 → 57406 [ACK] Seq=353 Ack=111 Win=2619648 Len=0

Frame 65: 44 bytes on wire (352 bits), 44 bytes captured (352 bits) on interface \Device\NPF_Loopback, id 0
Null/Loopback
Internet Protocol Version 4, Src: 192.168.56.1, Dst: 192.168.56.1
Transmission Control Protocol, Src Port: 40000, Dst Port: 57406, Seq: 353, Ack: 111, Len: 0

No.     Time           Source                Destination           Protocol Length Info
     66 68.246945      192.168.56.1          192.168.56.1          TCP      45     57406 → 40000 [PSH, ACK] Seq=111 Ack=353 Win=2619392 Len=1 [TCP segment of a reassembled PDU]

Frame 66: 45 bytes on wire (360 bits), 45 bytes captured (360 bits) on interface \Device\NPF_Loopback, id 0
Null/Loopback
Internet Protocol Version 4, Src: 192.168.56.1, Dst: 192.168.56.1
Transmission Control Protocol, Src Port: 57406, Dst Port: 40000, Seq: 111, Ack: 353, Len: 1

No.     Time           Source                Destination           Protocol Length Info
     67 68.246977      192.168.56.1          192.168.56.1          TCP      44     40000 → 57406 [ACK] Seq=353 Ack=112 Win=2619648 Len=0

Frame 67: 44 bytes on wire (352 bits), 44 bytes captured (352 bits) on interface \Device\NPF_Loopback, id 0
Null/Loopback
Internet Protocol Version 4, Src: 192.168.56.1, Dst: 192.168.56.1
Transmission Control Protocol, Src Port: 40000, Dst Port: 57406, Seq: 353, Ack: 112, Len: 0

No.     Time           Source                Destination           Protocol Length Info
     68 68.247409      192.168.56.1          192.168.56.1          TCP      70     40000 → 57406 [PSH, ACK] Seq=353 Ack=112 Win=2619648 Len=26 [TCP segment of a reassembled PDU]

Frame 68: 70 bytes on wire (560 bits), 70 bytes captured (560 bits) on interface \Device\NPF_Loopback, id 0
Null/Loopback
Internet Protocol Version 4, Src: 192.168.56.1, Dst: 192.168.56.1
Transmission Control Protocol, Src Port: 40000, Dst Port: 57406, Seq: 353, Ack: 112, Len: 26

No.     Time           Source                Destination           Protocol Length Info
     69 68.247458      192.168.56.1          192.168.56.1          TCP      44     57406 → 40000 [ACK] Seq=112 Ack=379 Win=2619392 Len=0

Frame 69: 44 bytes on wire (352 bits), 44 bytes captured (352 bits) on interface \Device\NPF_Loopback, id 0
Null/Loopback
Internet Protocol Version 4, Src: 192.168.56.1, Dst: 192.168.56.1
Transmission Control Protocol, Src Port: 57406, Dst Port: 40000, Seq: 112, Ack: 379, Len: 0

No.     Time           Source                Destination           Protocol Length Info
     70 85.540633      192.168.56.1          192.168.56.1          TCP      85     57406 → 40000 [PSH, ACK] Seq=112 Ack=379 Win=2619392 Len=41 [TCP segment of a reassembled PDU]

Frame 70: 85 bytes on wire (680 bits), 85 bytes captured (680 bits) on interface \Device\NPF_Loopback, id 0
Null/Loopback
Internet Protocol Version 4, Src: 192.168.56.1, Dst: 192.168.56.1
Transmission Control Protocol, Src Port: 57406, Dst Port: 40000, Seq: 112, Ack: 379, Len: 41

No.     Time           Source                Destination           Protocol Length Info
     71 85.540737      192.168.56.1          192.168.56.1          TCP      44     40000 → 57406 [ACK] Seq=379 Ack=153 Win=2619648 Len=0

Frame 71: 44 bytes on wire (352 bits), 44 bytes captured (352 bits) on interface \Device\NPF_Loopback, id 0
Null/Loopback
Internet Protocol Version 4, Src: 192.168.56.1, Dst: 192.168.56.1
Transmission Control Protocol, Src Port: 40000, Dst Port: 57406, Seq: 379, Ack: 153, Len: 0

No.     Time           Source                Destination           Protocol Length Info
     72 85.540789      192.168.56.1          192.168.56.1          TCP      45     57406 → 40000 [PSH, ACK] Seq=153 Ack=379 Win=2619392 Len=1 [TCP segment of a reassembled PDU]

Frame 72: 45 bytes on wire (360 bits), 45 bytes captured (360 bits) on interface \Device\NPF_Loopback, id 0
Null/Loopback
Internet Protocol Version 4, Src: 192.168.56.1, Dst: 192.168.56.1
Transmission Control Protocol, Src Port: 57406, Dst Port: 40000, Seq: 153, Ack: 379, Len: 1

No.     Time           Source                Destination           Protocol Length Info
     73 85.540816      192.168.56.1          192.168.56.1          TCP      44     40000 → 57406 [ACK] Seq=379 Ack=154 Win=2619648 Len=0

Frame 73: 44 bytes on wire (352 bits), 44 bytes captured (352 bits) on interface \Device\NPF_Loopback, id 0
Null/Loopback
Internet Protocol Version 4, Src: 192.168.56.1, Dst: 192.168.56.1
Transmission Control Protocol, Src Port: 40000, Dst Port: 57406, Seq: 379, Ack: 154, Len: 0

No.     Time           Source                Destination           Protocol Length Info
     74 85.543840      192.168.56.1          192.168.56.1          TCP      1788   40000 → 57406 [PSH, ACK] Seq=379 Ack=154 Win=2619648 Len=1744 [TCP segment of a reassembled PDU]

Frame 74: 1788 bytes on wire (14304 bits), 1788 bytes captured (14304 bits) on interface \Device\NPF_Loopback, id 0
Null/Loopback
Internet Protocol Version 4, Src: 192.168.56.1, Dst: 192.168.56.1
Transmission Control Protocol, Src Port: 40000, Dst Port: 57406, Seq: 379, Ack: 154, Len: 1744

No.     Time           Source                Destination           Protocol Length Info
     75 85.543933      192.168.56.1          192.168.56.1          TCP      44     57406 → 40000 [ACK] Seq=154 Ack=2123 Win=2617600 Len=0

Frame 75: 44 bytes on wire (352 bits), 44 bytes captured (352 bits) on interface \Device\NPF_Loopback, id 0
Null/Loopback
Internet Protocol Version 4, Src: 192.168.56.1, Dst: 192.168.56.1
Transmission Control Protocol, Src Port: 57406, Dst Port: 40000, Seq: 154, Ack: 2123, Len: 0

No.     Time           Source                Destination           Protocol Length Info
     76 87.506083      10.7.59.214           10.7.59.214           ICMP     73     Destination unreachable (Host unreachable)

Frame 76: 73 bytes on wire (584 bits), 73 bytes captured (584 bits) on interface \Device\NPF_Loopback, id 0
Null/Loopback
Internet Protocol Version 4, Src: 10.7.59.214, Dst: 10.7.59.214
Internet Control Message Protocol

No.     Time           Source                Destination           Protocol Length Info
     77 90.493772      10.7.59.214           10.7.59.214           ICMP     73     Destination unreachable (Host unreachable)

Frame 77: 73 bytes on wire (584 bits), 73 bytes captured (584 bits) on interface \Device\NPF_Loopback, id 0
Null/Loopback
Internet Protocol Version 4, Src: 10.7.59.214, Dst: 10.7.59.214
Internet Control Message Protocol

No.     Time           Source                Destination           Protocol Length Info
     78 90.585476      192.168.56.1          192.168.56.1          TCP      85     57406 → 40000 [PSH, ACK] Seq=154 Ack=2123 Win=2617600 Len=41 [TCP segment of a reassembled PDU]

Frame 78: 85 bytes on wire (680 bits), 85 bytes captured (680 bits) on interface \Device\NPF_Loopback, id 0
Null/Loopback
Internet Protocol Version 4, Src: 192.168.56.1, Dst: 192.168.56.1
Transmission Control Protocol, Src Port: 57406, Dst Port: 40000, Seq: 154, Ack: 2123, Len: 41

No.     Time           Source                Destination           Protocol Length Info
     79 90.585562      192.168.56.1          192.168.56.1          TCP      44     40000 → 57406 [ACK] Seq=2123 Ack=195 Win=2619392 Len=0

Frame 79: 44 bytes on wire (352 bits), 44 bytes captured (352 bits) on interface \Device\NPF_Loopback, id 0
Null/Loopback
Internet Protocol Version 4, Src: 192.168.56.1, Dst: 192.168.56.1
Transmission Control Protocol, Src Port: 40000, Dst Port: 57406, Seq: 2123, Ack: 195, Len: 0

No.     Time           Source                Destination           Protocol Length Info
     80 90.585602      192.168.56.1          192.168.56.1          TCP      45     57406 → 40000 [PSH, ACK] Seq=195 Ack=2123 Win=2617600 Len=1 [TCP segment of a reassembled PDU]

Frame 80: 45 bytes on wire (360 bits), 45 bytes captured (360 bits) on interface \Device\NPF_Loopback, id 0
Null/Loopback
Internet Protocol Version 4, Src: 192.168.56.1, Dst: 192.168.56.1
Transmission Control Protocol, Src Port: 57406, Dst Port: 40000, Seq: 195, Ack: 2123, Len: 1

No.     Time           Source                Destination           Protocol Length Info
     81 90.585622      192.168.56.1          192.168.56.1          TCP      44     40000 → 57406 [ACK] Seq=2123 Ack=196 Win=2619392 Len=0

Frame 81: 44 bytes on wire (352 bits), 44 bytes captured (352 bits) on interface \Device\NPF_Loopback, id 0
Null/Loopback
Internet Protocol Version 4, Src: 192.168.56.1, Dst: 192.168.56.1
Transmission Control Protocol, Src Port: 40000, Dst Port: 57406, Seq: 2123, Ack: 196, Len: 0

No.     Time           Source                Destination           Protocol Length Info
     82 90.588121      192.168.56.1          192.168.56.1          TCP      1788   40000 → 57406 [PSH, ACK] Seq=2123 Ack=196 Win=2619392 Len=1744 [TCP segment of a reassembled PDU]

Frame 82: 1788 bytes on wire (14304 bits), 1788 bytes captured (14304 bits) on interface \Device\NPF_Loopback, id 0
Null/Loopback
Internet Protocol Version 4, Src: 192.168.56.1, Dst: 192.168.56.1
Transmission Control Protocol, Src Port: 40000, Dst Port: 57406, Seq: 2123, Ack: 196, Len: 1744

No.     Time           Source                Destination           Protocol Length Info
     83 90.588179      192.168.56.1          192.168.56.1          TCP      44     57406 → 40000 [ACK] Seq=196 Ack=3867 Win=2615808 Len=0

Frame 83: 44 bytes on wire (352 bits), 44 bytes captured (352 bits) on interface \Device\NPF_Loopback, id 0
Null/Loopback
Internet Protocol Version 4, Src: 192.168.56.1, Dst: 192.168.56.1
Transmission Control Protocol, Src Port: 57406, Dst Port: 40000, Seq: 196, Ack: 3867, Len: 0

No.     Time           Source                Destination           Protocol Length Info
     84 93.494844      10.7.59.214           10.7.59.214           ICMP     98     Destination unreachable (Host unreachable)

Frame 84: 98 bytes on wire (784 bits), 98 bytes captured (784 bits) on interface \Device\NPF_Loopback, id 0
Null/Loopback
Internet Protocol Version 4, Src: 10.7.59.214, Dst: 10.7.59.214
Internet Control Message Protocol
Domain Name System (query)

No.     Time           Source                Destination           Protocol Length Info
     85 95.355277      192.168.56.1          192.168.56.1          TCP      85     57406 → 40000 [PSH, ACK] Seq=196 Ack=3867 Win=2615808 Len=41 [TCP segment of a reassembled PDU]

Frame 85: 85 bytes on wire (680 bits), 85 bytes captured (680 bits) on interface \Device\NPF_Loopback, id 0
Null/Loopback
Internet Protocol Version 4, Src: 192.168.56.1, Dst: 192.168.56.1
Transmission Control Protocol, Src Port: 57406, Dst Port: 40000, Seq: 196, Ack: 3867, Len: 41

No.     Time           Source                Destination           Protocol Length Info
     86 95.355347      192.168.56.1          192.168.56.1          TCP      44     40000 → 57406 [ACK] Seq=3867 Ack=237 Win=2619392 Len=0

Frame 86: 44 bytes on wire (352 bits), 44 bytes captured (352 bits) on interface \Device\NPF_Loopback, id 0
Null/Loopback
Internet Protocol Version 4, Src: 192.168.56.1, Dst: 192.168.56.1
Transmission Control Protocol, Src Port: 40000, Dst Port: 57406, Seq: 3867, Ack: 237, Len: 0

No.     Time           Source                Destination           Protocol Length Info
     87 95.355399      192.168.56.1          192.168.56.1          TCP      45     57406 → 40000 [PSH, ACK] Seq=237 Ack=3867 Win=2615808 Len=1 [TCP segment of a reassembled PDU]

Frame 87: 45 bytes on wire (360 bits), 45 bytes captured (360 bits) on interface \Device\NPF_Loopback, id 0
Null/Loopback
Internet Protocol Version 4, Src: 192.168.56.1, Dst: 192.168.56.1
Transmission Control Protocol, Src Port: 57406, Dst Port: 40000, Seq: 237, Ack: 3867, Len: 1

No.     Time           Source                Destination           Protocol Length Info
     88 95.355428      192.168.56.1          192.168.56.1          TCP      44     40000 → 57406 [ACK] Seq=3867 Ack=238 Win=2619392 Len=0

Frame 88: 44 bytes on wire (352 bits), 44 bytes captured (352 bits) on interface \Device\NPF_Loopback, id 0
Null/Loopback
Internet Protocol Version 4, Src: 192.168.56.1, Dst: 192.168.56.1
Transmission Control Protocol, Src Port: 40000, Dst Port: 57406, Seq: 3867, Ack: 238, Len: 0

No.     Time           Source                Destination           Protocol Length Info
     89 95.357052      192.168.56.1          192.168.56.1          TCP      1788   40000 → 57406 [PSH, ACK] Seq=3867 Ack=238 Win=2619392 Len=1744 [TCP segment of a reassembled PDU]

Frame 89: 1788 bytes on wire (14304 bits), 1788 bytes captured (14304 bits) on interface \Device\NPF_Loopback, id 0
Null/Loopback
Internet Protocol Version 4, Src: 192.168.56.1, Dst: 192.168.56.1
Transmission Control Protocol, Src Port: 40000, Dst Port: 57406, Seq: 3867, Ack: 238, Len: 1744

No.     Time           Source                Destination           Protocol Length Info
     90 95.357119      192.168.56.1          192.168.56.1          TCP      44     57406 → 40000 [ACK] Seq=238 Ack=5611 Win=2614016 Len=0

Frame 90: 44 bytes on wire (352 bits), 44 bytes captured (352 bits) on interface \Device\NPF_Loopback, id 0
Null/Loopback
Internet Protocol Version 4, Src: 192.168.56.1, Dst: 192.168.56.1
Transmission Control Protocol, Src Port: 57406, Dst Port: 40000, Seq: 238, Ack: 5611, Len: 0

No.     Time           Source                Destination           Protocol Length Info
     91 96.503127      10.7.59.214           10.7.59.214           ICMP     73     Destination unreachable (Host unreachable)

Frame 91: 73 bytes on wire (584 bits), 73 bytes captured (584 bits) on interface \Device\NPF_Loopback, id 0
Null/Loopback
Internet Protocol Version 4, Src: 10.7.59.214, Dst: 10.7.59.214
Internet Control Message Protocol

No.     Time           Source                Destination           Protocol Length Info
     92 103.564567     192.168.56.1          192.168.56.1          TCP      85     57406 → 40000 [PSH, ACK] Seq=238 Ack=5611 Win=2614016 Len=41 [TCP segment of a reassembled PDU]

Frame 92: 85 bytes on wire (680 bits), 85 bytes captured (680 bits) on interface \Device\NPF_Loopback, id 0
Null/Loopback
Internet Protocol Version 4, Src: 192.168.56.1, Dst: 192.168.56.1
Transmission Control Protocol, Src Port: 57406, Dst Port: 40000, Seq: 238, Ack: 5611, Len: 41

No.     Time           Source                Destination           Protocol Length Info
     93 103.564648     192.168.56.1          192.168.56.1          TCP      44     40000 → 57406 [ACK] Seq=5611 Ack=279 Win=2619392 Len=0

Frame 93: 44 bytes on wire (352 bits), 44 bytes captured (352 bits) on interface \Device\NPF_Loopback, id 0
Null/Loopback
Internet Protocol Version 4, Src: 192.168.56.1, Dst: 192.168.56.1
Transmission Control Protocol, Src Port: 40000, Dst Port: 57406, Seq: 5611, Ack: 279, Len: 0

No.     Time           Source                Destination           Protocol Length Info
     94 103.564700     192.168.56.1          192.168.56.1          TCP      45     57406 → 40000 [PSH, ACK] Seq=279 Ack=5611 Win=2614016 Len=1 [TCP segment of a reassembled PDU]

Frame 94: 45 bytes on wire (360 bits), 45 bytes captured (360 bits) on interface \Device\NPF_Loopback, id 0
Null/Loopback
Internet Protocol Version 4, Src: 192.168.56.1, Dst: 192.168.56.1
Transmission Control Protocol, Src Port: 57406, Dst Port: 40000, Seq: 279, Ack: 5611, Len: 1

No.     Time           Source                Destination           Protocol Length Info
     95 103.564738     192.168.56.1          192.168.56.1          TCP      44     40000 → 57406 [ACK] Seq=5611 Ack=280 Win=2619392 Len=0

Frame 95: 44 bytes on wire (352 bits), 44 bytes captured (352 bits) on interface \Device\NPF_Loopback, id 0
Null/Loopback
Internet Protocol Version 4, Src: 192.168.56.1, Dst: 192.168.56.1
Transmission Control Protocol, Src Port: 40000, Dst Port: 57406, Seq: 5611, Ack: 280, Len: 0

No.     Time           Source                Destination           Protocol Length Info
     96 103.565458     192.168.56.1          192.168.56.1          TCP      1788   57406 → 40000 [PSH, ACK] Seq=280 Ack=5611 Win=2614016 Len=1744 [TCP segment of a reassembled PDU]

Frame 96: 1788 bytes on wire (14304 bits), 1788 bytes captured (14304 bits) on interface \Device\NPF_Loopback, id 0
Null/Loopback
Internet Protocol Version 4, Src: 192.168.56.1, Dst: 192.168.56.1
Transmission Control Protocol, Src Port: 57406, Dst Port: 40000, Seq: 280, Ack: 5611, Len: 1744

No.     Time           Source                Destination           Protocol Length Info
     97 103.565534     192.168.56.1          192.168.56.1          TCP      44     40000 → 57406 [ACK] Seq=5611 Ack=2024 Win=2617600 Len=0

Frame 97: 44 bytes on wire (352 bits), 44 bytes captured (352 bits) on interface \Device\NPF_Loopback, id 0
Null/Loopback
Internet Protocol Version 4, Src: 192.168.56.1, Dst: 192.168.56.1
Transmission Control Protocol, Src Port: 40000, Dst Port: 57406, Seq: 5611, Ack: 2024, Len: 0

No.     Time           Source                Destination           Protocol Length Info
     98 106.247923     192.168.56.1          192.168.56.1          TCP      85     57406 → 40000 [PSH, ACK] Seq=2024 Ack=5611 Win=2614016 Len=41 [TCP segment of a reassembled PDU]

Frame 98: 85 bytes on wire (680 bits), 85 bytes captured (680 bits) on interface \Device\NPF_Loopback, id 0
Null/Loopback
Internet Protocol Version 4, Src: 192.168.56.1, Dst: 192.168.56.1
Transmission Control Protocol, Src Port: 57406, Dst Port: 40000, Seq: 2024, Ack: 5611, Len: 41

No.     Time           Source                Destination           Protocol Length Info
     99 106.247993     192.168.56.1          192.168.56.1          TCP      44     40000 → 57406 [ACK] Seq=5611 Ack=2065 Win=2617600 Len=0

Frame 99: 44 bytes on wire (352 bits), 44 bytes captured (352 bits) on interface \Device\NPF_Loopback, id 0
Null/Loopback
Internet Protocol Version 4, Src: 192.168.56.1, Dst: 192.168.56.1
Transmission Control Protocol, Src Port: 40000, Dst Port: 57406, Seq: 5611, Ack: 2065, Len: 0

No.     Time           Source                Destination           Protocol Length Info
    100 106.248056     192.168.56.1          192.168.56.1          TCP      45     57406 → 40000 [PSH, ACK] Seq=2065 Ack=5611 Win=2614016 Len=1 [TCP segment of a reassembled PDU]

Frame 100: 45 bytes on wire (360 bits), 45 bytes captured (360 bits) on interface \Device\NPF_Loopback, id 0
Null/Loopback
Internet Protocol Version 4, Src: 192.168.56.1, Dst: 192.168.56.1
Transmission Control Protocol, Src Port: 57406, Dst Port: 40000, Seq: 2065, Ack: 5611, Len: 1

No.     Time           Source                Destination           Protocol Length Info
    101 106.248094     192.168.56.1          192.168.56.1          TCP      44     40000 → 57406 [ACK] Seq=5611 Ack=2066 Win=2617600 Len=0

Frame 101: 44 bytes on wire (352 bits), 44 bytes captured (352 bits) on interface \Device\NPF_Loopback, id 0
Null/Loopback
Internet Protocol Version 4, Src: 192.168.56.1, Dst: 192.168.56.1
Transmission Control Protocol, Src Port: 40000, Dst Port: 57406, Seq: 5611, Ack: 2066, Len: 0

No.     Time           Source                Destination           Protocol Length Info
    102 106.250350     192.168.56.1          192.168.56.1          TCP      1788   57406 → 40000 [PSH, ACK] Seq=2066 Ack=5611 Win=2614016 Len=1744 [TCP segment of a reassembled PDU]

Frame 102: 1788 bytes on wire (14304 bits), 1788 bytes captured (14304 bits) on interface \Device\NPF_Loopback, id 0
Null/Loopback
Internet Protocol Version 4, Src: 192.168.56.1, Dst: 192.168.56.1
Transmission Control Protocol, Src Port: 57406, Dst Port: 40000, Seq: 2066, Ack: 5611, Len: 1744

No.     Time           Source                Destination           Protocol Length Info
    103 106.250394     192.168.56.1          192.168.56.1          TCP      44     40000 → 57406 [ACK] Seq=5611 Ack=3810 Win=2615808 Len=0

Frame 103: 44 bytes on wire (352 bits), 44 bytes captured (352 bits) on interface \Device\NPF_Loopback, id 0
Null/Loopback
Internet Protocol Version 4, Src: 192.168.56.1, Dst: 192.168.56.1
Transmission Control Protocol, Src Port: 40000, Dst Port: 57406, Seq: 5611, Ack: 3810, Len: 0

No.     Time           Source                Destination           Protocol Length Info
    104 108.404897     192.168.56.1          192.168.56.1          TCP      85     57406 → 40000 [PSH, ACK] Seq=3810 Ack=5611 Win=2614016 Len=41 [TCP segment of a reassembled PDU]

Frame 104: 85 bytes on wire (680 bits), 85 bytes captured (680 bits) on interface \Device\NPF_Loopback, id 0
Null/Loopback
Internet Protocol Version 4, Src: 192.168.56.1, Dst: 192.168.56.1
Transmission Control Protocol, Src Port: 57406, Dst Port: 40000, Seq: 3810, Ack: 5611, Len: 41

No.     Time           Source                Destination           Protocol Length Info
    105 108.405007     192.168.56.1          192.168.56.1          TCP      44     40000 → 57406 [ACK] Seq=5611 Ack=3851 Win=2615808 Len=0

Frame 105: 44 bytes on wire (352 bits), 44 bytes captured (352 bits) on interface \Device\NPF_Loopback, id 0
Null/Loopback
Internet Protocol Version 4, Src: 192.168.56.1, Dst: 192.168.56.1
Transmission Control Protocol, Src Port: 40000, Dst Port: 57406, Seq: 5611, Ack: 3851, Len: 0

No.     Time           Source                Destination           Protocol Length Info
    106 108.405083     192.168.56.1          192.168.56.1          TCP      45     57406 → 40000 [PSH, ACK] Seq=3851 Ack=5611 Win=2614016 Len=1 [TCP segment of a reassembled PDU]

Frame 106: 45 bytes on wire (360 bits), 45 bytes captured (360 bits) on interface \Device\NPF_Loopback, id 0
Null/Loopback
Internet Protocol Version 4, Src: 192.168.56.1, Dst: 192.168.56.1
Transmission Control Protocol, Src Port: 57406, Dst Port: 40000, Seq: 3851, Ack: 5611, Len: 1

No.     Time           Source                Destination           Protocol Length Info
    107 108.405167     192.168.56.1          192.168.56.1          TCP      44     40000 → 57406 [ACK] Seq=5611 Ack=3852 Win=2615808 Len=0

Frame 107: 44 bytes on wire (352 bits), 44 bytes captured (352 bits) on interface \Device\NPF_Loopback, id 0
Null/Loopback
Internet Protocol Version 4, Src: 192.168.56.1, Dst: 192.168.56.1
Transmission Control Protocol, Src Port: 40000, Dst Port: 57406, Seq: 5611, Ack: 3852, Len: 0

No.     Time           Source                Destination           Protocol Length Info
    108 108.406434     192.168.56.1          192.168.56.1          TCP      1788   57406 → 40000 [PSH, ACK] Seq=3852 Ack=5611 Win=2614016 Len=1744 [TCP segment of a reassembled PDU]

Frame 108: 1788 bytes on wire (14304 bits), 1788 bytes captured (14304 bits) on interface \Device\NPF_Loopback, id 0
Null/Loopback
Internet Protocol Version 4, Src: 192.168.56.1, Dst: 192.168.56.1
Transmission Control Protocol, Src Port: 57406, Dst Port: 40000, Seq: 3852, Ack: 5611, Len: 1744

No.     Time           Source                Destination           Protocol Length Info
    109 108.406527     192.168.56.1          192.168.56.1          TCP      44     40000 → 57406 [ACK] Seq=5611 Ack=5596 Win=2614016 Len=0

Frame 109: 44 bytes on wire (352 bits), 44 bytes captured (352 bits) on interface \Device\NPF_Loopback, id 0
Null/Loopback
Internet Protocol Version 4, Src: 192.168.56.1, Dst: 192.168.56.1
Transmission Control Protocol, Src Port: 40000, Dst Port: 57406, Seq: 5611, Ack: 5596, Len: 0

No.     Time           Source                Destination           Protocol Length Info
    110 113.527487     192.168.56.1          192.168.56.1          TCP      44     57406 → 40000 [FIN, ACK] Seq=5596 Ack=5611 Win=2614016 Len=0

Frame 110: 44 bytes on wire (352 bits), 44 bytes captured (352 bits) on interface \Device\NPF_Loopback, id 0
Null/Loopback
Internet Protocol Version 4, Src: 192.168.56.1, Dst: 192.168.56.1
Transmission Control Protocol, Src Port: 57406, Dst Port: 40000, Seq: 5596, Ack: 5611, Len: 0

No.     Time           Source                Destination           Protocol Length Info
    111 113.527576     192.168.56.1          192.168.56.1          TCP      44     40000 → 57406 [ACK] Seq=5611 Ack=5597 Win=2614016 Len=0

Frame 111: 44 bytes on wire (352 bits), 44 bytes captured (352 bits) on interface \Device\NPF_Loopback, id 0
Null/Loopback
Internet Protocol Version 4, Src: 192.168.56.1, Dst: 192.168.56.1
Transmission Control Protocol, Src Port: 40000, Dst Port: 57406, Seq: 5611, Ack: 5597, Len: 0

No.     Time           Source                Destination           Protocol Length Info
    112 113.532372     192.168.56.1          192.168.56.1          TCP      44     40000 → 57406 [FIN, ACK] Seq=5611 Ack=5597 Win=2614016 Len=0

Frame 112: 44 bytes on wire (352 bits), 44 bytes captured (352 bits) on interface \Device\NPF_Loopback, id 0
Null/Loopback
Internet Protocol Version 4, Src: 192.168.56.1, Dst: 192.168.56.1
Transmission Control Protocol, Src Port: 40000, Dst Port: 57406, Seq: 5611, Ack: 5597, Len: 0

No.     Time           Source                Destination           Protocol Length Info
    113 113.532470     192.168.56.1          192.168.56.1          TCP      44     57406 → 40000 [ACK] Seq=5597 Ack=5612 Win=2614016 Len=0

Frame 113: 44 bytes on wire (352 bits), 44 bytes captured (352 bits) on interface \Device\NPF_Loopback, id 0
Null/Loopback
Internet Protocol Version 4, Src: 192.168.56.1, Dst: 192.168.56.1
Transmission Control Protocol, Src Port: 57406, Dst Port: 40000, Seq: 5597, Ack: 5612, Len: 0

No.     Time           Source                Destination           Protocol Length Info
    114 143.004902     10.7.59.214           10.7.59.214           ICMP     73     Destination unreachable (Host unreachable)

Frame 114: 73 bytes on wire (584 bits), 73 bytes captured (584 bits) on interface \Device\NPF_Loopback, id 0
Null/Loopback
Internet Protocol Version 4, Src: 10.7.59.214, Dst: 10.7.59.214
Internet Control Message Protocol

No.     Time           Source                Destination           Protocol Length Info
    115 154.902711     192.168.56.1          239.255.255.250       SSDP     207    M-SEARCH * HTTP/1.1 

Frame 115: 207 bytes on wire (1656 bits), 207 bytes captured (1656 bits) on interface \Device\NPF_Loopback, id 0
Null/Loopback
Internet Protocol Version 4, Src: 192.168.56.1, Dst: 239.255.255.250
User Datagram Protocol, Src Port: 58913, Dst Port: 1900
Simple Service Discovery Protocol

No.     Time           Source                Destination           Protocol Length Info
    116 154.949686     192.168.56.1          239.255.255.250       SSDP     201    M-SEARCH * HTTP/1.1 

Frame 116: 201 bytes on wire (1608 bits), 201 bytes captured (1608 bits) on interface \Device\NPF_Loopback, id 0
Null/Loopback
Internet Protocol Version 4, Src: 192.168.56.1, Dst: 239.255.255.250
User Datagram Protocol, Src Port: 58914, Dst Port: 1900
Simple Service Discovery Protocol

No.     Time           Source                Destination           Protocol Length Info
    117 155.918761     192.168.56.1          239.255.255.250       SSDP     207    M-SEARCH * HTTP/1.1 

Frame 117: 207 bytes on wire (1656 bits), 207 bytes captured (1656 bits) on interface \Device\NPF_Loopback, id 0
Null/Loopback
Internet Protocol Version 4, Src: 192.168.56.1, Dst: 239.255.255.250
User Datagram Protocol, Src Port: 58913, Dst Port: 1900
Simple Service Discovery Protocol

No.     Time           Source                Destination           Protocol Length Info
    118 155.964884     192.168.56.1          239.255.255.250       SSDP     201    M-SEARCH * HTTP/1.1 

Frame 118: 201 bytes on wire (1608 bits), 201 bytes captured (1608 bits) on interface \Device\NPF_Loopback, id 0
Null/Loopback
Internet Protocol Version 4, Src: 192.168.56.1, Dst: 239.255.255.250
User Datagram Protocol, Src Port: 58914, Dst Port: 1900
Simple Service Discovery Protocol

No.     Time           Source                Destination           Protocol Length Info
    119 156.932429     192.168.56.1          239.255.255.250       SSDP     207    M-SEARCH * HTTP/1.1 

Frame 119: 207 bytes on wire (1656 bits), 207 bytes captured (1656 bits) on interface \Device\NPF_Loopback, id 0
Null/Loopback
Internet Protocol Version 4, Src: 192.168.56.1, Dst: 239.255.255.250
User Datagram Protocol, Src Port: 58913, Dst Port: 1900
Simple Service Discovery Protocol

No.     Time           Source                Destination           Protocol Length Info
    120 156.979498     192.168.56.1          239.255.255.250       SSDP     201    M-SEARCH * HTTP/1.1 

Frame 120: 201 bytes on wire (1608 bits), 201 bytes captured (1608 bits) on interface \Device\NPF_Loopback, id 0
Null/Loopback
Internet Protocol Version 4, Src: 192.168.56.1, Dst: 239.255.255.250
User Datagram Protocol, Src Port: 58914, Dst Port: 1900
Simple Service Discovery Protocol

No.     Time           Source                Destination           Protocol Length Info
    121 157.944849     192.168.56.1          239.255.255.250       SSDP     207    M-SEARCH * HTTP/1.1 

Frame 121: 207 bytes on wire (1656 bits), 207 bytes captured (1656 bits) on interface \Device\NPF_Loopback, id 0
Null/Loopback
Internet Protocol Version 4, Src: 192.168.56.1, Dst: 239.255.255.250
User Datagram Protocol, Src Port: 58913, Dst Port: 1900
Simple Service Discovery Protocol

No.     Time           Source                Destination           Protocol Length Info
    122 157.991406     192.168.56.1          239.255.255.250       SSDP     201    M-SEARCH * HTTP/1.1 

Frame 122: 201 bytes on wire (1608 bits), 201 bytes captured (1608 bits) on interface \Device\NPF_Loopback, id 0
Null/Loopback
Internet Protocol Version 4, Src: 192.168.56.1, Dst: 239.255.255.250
User Datagram Protocol, Src Port: 58914, Dst Port: 1900
Simple Service Discovery Protocol

No.     Time           Source                Destination           Protocol Length Info
    123 168.202311     127.0.0.1             127.0.0.1             DNS      65     Standard query 0x84b5 A su.ff.avast.com

Frame 123: 65 bytes on wire (520 bits), 65 bytes captured (520 bits) on interface \Device\NPF_Loopback, id 0
Null/Loopback
Internet Protocol Version 4, Src: 127.0.0.1, Dst: 127.0.0.1
User Datagram Protocol, Src Port: 58915, Dst Port: 53
Domain Name System (query)

No.     Time           Source                Destination           Protocol Length Info
    124 168.202342     127.0.0.1             127.0.0.1             ICMP     93     Destination unreachable (Port unreachable)

Frame 124: 93 bytes on wire (744 bits), 93 bytes captured (744 bits) on interface \Device\NPF_Loopback, id 0
Null/Loopback
Internet Protocol Version 4, Src: 127.0.0.1, Dst: 127.0.0.1
Internet Control Message Protocol
Domain Name System (query)

No.     Time           Source                Destination           Protocol Length Info
    125 168.202920     127.0.0.1             127.0.0.1             DNS      65     Standard query 0xf687 AAAA su.ff.avast.com

Frame 125: 65 bytes on wire (520 bits), 65 bytes captured (520 bits) on interface \Device\NPF_Loopback, id 0
Null/Loopback
Internet Protocol Version 4, Src: 127.0.0.1, Dst: 127.0.0.1
User Datagram Protocol, Src Port: 58915, Dst Port: 53
Domain Name System (query)

No.     Time           Source                Destination           Protocol Length Info
    126 168.202964     127.0.0.1             127.0.0.1             ICMP     93     Destination unreachable (Port unreachable)

Frame 126: 93 bytes on wire (744 bits), 93 bytes captured (744 bits) on interface \Device\NPF_Loopback, id 0
Null/Loopback
Internet Protocol Version 4, Src: 127.0.0.1, Dst: 127.0.0.1
Internet Control Message Protocol
Domain Name System (query)

No.     Time           Source                Destination           Protocol Length Info
    127 168.203334     127.0.0.1             127.0.0.1             DNS      65     Standard query 0x84b5 A su.ff.avast.com

Frame 127: 65 bytes on wire (520 bits), 65 bytes captured (520 bits) on interface \Device\NPF_Loopback, id 0
Null/Loopback
Internet Protocol Version 4, Src: 127.0.0.1, Dst: 127.0.0.1
User Datagram Protocol, Src Port: 58916, Dst Port: 53
Domain Name System (query)

No.     Time           Source                Destination           Protocol Length Info
    128 168.203355     127.0.0.1             127.0.0.1             ICMP     93     Destination unreachable (Port unreachable)

Frame 128: 93 bytes on wire (744 bits), 93 bytes captured (744 bits) on interface \Device\NPF_Loopback, id 0
Null/Loopback
Internet Protocol Version 4, Src: 127.0.0.1, Dst: 127.0.0.1
Internet Control Message Protocol
Domain Name System (query)

No.     Time           Source                Destination           Protocol Length Info
    129 168.203387     127.0.0.1             127.0.0.1             DNS      65     Standard query 0xf687 AAAA su.ff.avast.com

Frame 129: 65 bytes on wire (520 bits), 65 bytes captured (520 bits) on interface \Device\NPF_Loopback, id 0
Null/Loopback
Internet Protocol Version 4, Src: 127.0.0.1, Dst: 127.0.0.1
User Datagram Protocol, Src Port: 58916, Dst Port: 53
Domain Name System (query)

No.     Time           Source                Destination           Protocol Length Info
    130 168.203399     127.0.0.1             127.0.0.1             ICMP     93     Destination unreachable (Port unreachable)

Frame 130: 93 bytes on wire (744 bits), 93 bytes captured (744 bits) on interface \Device\NPF_Loopback, id 0
Null/Loopback
Internet Protocol Version 4, Src: 127.0.0.1, Dst: 127.0.0.1
Internet Control Message Protocol
Domain Name System (query)

No.     Time           Source                Destination           Protocol Length Info
    131 168.203704     127.0.0.1             127.0.0.1             DNS      65     Standard query 0x84b5 A su.ff.avast.com

Frame 131: 65 bytes on wire (520 bits), 65 bytes captured (520 bits) on interface \Device\NPF_Loopback, id 0
Null/Loopback
Internet Protocol Version 4, Src: 127.0.0.1, Dst: 127.0.0.1
User Datagram Protocol, Src Port: 58917, Dst Port: 53
Domain Name System (query)

No.     Time           Source                Destination           Protocol Length Info
    132 168.203722     127.0.0.1             127.0.0.1             ICMP     93     Destination unreachable (Port unreachable)

Frame 132: 93 bytes on wire (744 bits), 93 bytes captured (744 bits) on interface \Device\NPF_Loopback, id 0
Null/Loopback
Internet Protocol Version 4, Src: 127.0.0.1, Dst: 127.0.0.1
Internet Control Message Protocol
Domain Name System (query)

No.     Time           Source                Destination           Protocol Length Info
    133 168.203753     127.0.0.1             127.0.0.1             DNS      65     Standard query 0xf687 AAAA su.ff.avast.com

Frame 133: 65 bytes on wire (520 bits), 65 bytes captured (520 bits) on interface \Device\NPF_Loopback, id 0
Null/Loopback
Internet Protocol Version 4, Src: 127.0.0.1, Dst: 127.0.0.1
User Datagram Protocol, Src Port: 58917, Dst Port: 53
Domain Name System (query)

No.     Time           Source                Destination           Protocol Length Info
    134 168.203765     127.0.0.1             127.0.0.1             ICMP     93     Destination unreachable (Port unreachable)

Frame 134: 93 bytes on wire (744 bits), 93 bytes captured (744 bits) on interface \Device\NPF_Loopback, id 0
Null/Loopback
Internet Protocol Version 4, Src: 127.0.0.1, Dst: 127.0.0.1
Internet Control Message Protocol
Domain Name System (query)

No.     Time           Source                Destination           Protocol Length Info
    135 168.204090     127.0.0.1             127.0.0.1             DNS      65     Standard query 0x84b5 A su.ff.avast.com

Frame 135: 65 bytes on wire (520 bits), 65 bytes captured (520 bits) on interface \Device\NPF_Loopback, id 0
Null/Loopback
Internet Protocol Version 4, Src: 127.0.0.1, Dst: 127.0.0.1
User Datagram Protocol, Src Port: 58918, Dst Port: 53
Domain Name System (query)

No.     Time           Source                Destination           Protocol Length Info
    136 168.204108     127.0.0.1             127.0.0.1             ICMP     93     Destination unreachable (Port unreachable)

Frame 136: 93 bytes on wire (744 bits), 93 bytes captured (744 bits) on interface \Device\NPF_Loopback, id 0
Null/Loopback
Internet Protocol Version 4, Src: 127.0.0.1, Dst: 127.0.0.1
Internet Control Message Protocol
Domain Name System (query)

No.     Time           Source                Destination           Protocol Length Info
    137 168.204145     127.0.0.1             127.0.0.1             DNS      65     Standard query 0xf687 AAAA su.ff.avast.com

Frame 137: 65 bytes on wire (520 bits), 65 bytes captured (520 bits) on interface \Device\NPF_Loopback, id 0
Null/Loopback
Internet Protocol Version 4, Src: 127.0.0.1, Dst: 127.0.0.1
User Datagram Protocol, Src Port: 58918, Dst Port: 53
Domain Name System (query)

No.     Time           Source                Destination           Protocol Length Info
    138 168.204177     127.0.0.1             127.0.0.1             ICMP     93     Destination unreachable (Port unreachable)

Frame 138: 93 bytes on wire (744 bits), 93 bytes captured (744 bits) on interface \Device\NPF_Loopback, id 0
Null/Loopback
Internet Protocol Version 4, Src: 127.0.0.1, Dst: 127.0.0.1
Internet Control Message Protocol
Domain Name System (query)

No.     Time           Source                Destination           Protocol Length Info
    139 188.001501     10.7.59.214           10.7.59.214           ICMP     73     Destination unreachable (Host unreachable)

Frame 139: 73 bytes on wire (584 bits), 73 bytes captured (584 bits) on interface \Device\NPF_Loopback, id 0
Null/Loopback
Internet Protocol Version 4, Src: 10.7.59.214, Dst: 10.7.59.214
Internet Control Message Protocol
